34,,,10,"Music_of_Latin_America, Pop_music, Music, Christian_music",12.87%,pt,34,UCkskLrHR3ga1AG_QS-trE6w,Musile Records,6060000,we3d6SVqcpI,2025-03-13T13:00:06Z,19.65 horas,Sarah Beatriz e Bruna Karla - O Teu Poder (Creio Em Ti) | Famous For (I Believe) - Ao Vivo,"Sarah Beatriz e Bruna Karla - O Teu Poder (Creio Em Ti) | Famous For (I Believe) - Ao Vivo

▸ Ouça Sarah Beatriz e Bruna Karla - O Teu Poder (Creio em Ti):
https://musile.lnk.to/sbotpcet
▸ Baixe Sarah Beatriz e Bruna Karla - O Teu Poder (Creio em Ti):
https://musile.lnk.to/sbotpcetd
▸ Baixe o playback Sarah Beatriz e Bruna Karla - O Teu Poder (Creio em Ti):
https://musile.lnk.to/sbotpcetp
▸ Inscreva-se no canal da Musile Records:
https://www.youtube.com/musilerecords
▸ Inscreva-se no canal da Sarah Beatriz:
https://www.youtube.com/channel/UCNwql3VL1H62zMY_btrUjzg
▸ Siga a Musile Records nos apps de música:
https://musile.lnk.to/musilerecords
▸ Siga a Sarah Beatriz nos apps de música:
https://musile.lnk.to/sarahbeatriz

Famous For (I Believe), um dos grandes sucessos de @taurenwellsmusic, ganha uma versão oficial em português nas vozes de @SarahBeatrizOficial e @BrunaKarlaOficial. O louvor O Teu Poder (Creio em Ti) faz parte do recente projeto de Sarah Bia em parceria com a Musile Records, que conta com nove faixas, entre elas, Pentecostes, Deus na Minha História, Chega de Errar Pra Aprender, com Eli Soares e Mauro Henrique, Tu És a Direção e A Alegria do Senhor.

Ao longo da sua trajetória na música cristã, Sarah tem diversos sucessos gospel, como O Medo Não Vai Me Parar, O Maior Vilão Sou Eu, Todavia Me Alegrarei e Promessas, com Samuel Messias. Já Bruna Karla, referência na música gospel, tem hits de adoração como Cicatrizes, Quando Eu Chorar e Sou Humano. Seu talento lhe rendeu seis indicações ao Grammy Latino, entre elas, Melhor Álbum de Música Cristã em Língua Portuguesa com Ele é Jesus.

▸ Letra:

Não vou temer, pois creio em Ti
Nem duvidar, pois eu já vi
Em Ti está minha força, todos os dias

Minha esperança está em Ti
A Tua graça sustenta-me
Em Ti está minha força, todos os dias

Através das águas
Através do fogo
Vem e mostra o Teu poder
Revela o Teu poder
Cala o inimigo
Traz vida ao perdido
Vem e mostra o Teu poder
Revela o Teu poder

Creio em Ti, Senhor
Eu creio em Ti, Senhor

Com Teu amor, vem me encher
Todos verão o Teu poder
Espírito, vem sobre nós
Todos os dias, Senhor

Deus de Promessas, Deus Grandioso
Maior que o meu pensar
Tu nunca falharás
Nada Te impedirá, Teu nome vencerá
Tudo é possível em Ti

Compositores: Alexis Slifer, Chuck Bluter, Jordan Sapp, Krissy Nordhoff e Tauren Wells
Versionista: Thomas Alves

▸ Ficha Técnica:

Produção Musical e Violões: Hananiel Eduardo
Bateria: Well Duarte
Baixo: Jhonny Anderson
Teclados: Davidson Aquila
Guitarras: Everson Menezes
F.O.H e Coordenador de Audio: Lucas Putini
Tecnico de Gravação: Vinicius Gimenez
Tecnico de Monitor: Ronaldo
Roadies: Lucas Rosa e Jonas Putini
Edição Digital: Vinicius Gimenez
Edição Vocal: Lucas Rosa
Mixagem: Bernardo Fragale
Masterização: Luciano Vassão
Regente Coral: Mari Rocha

Direção de Vídeo: Flauzilino Jr.
Produtora: FJR. CREW
Produção: Pedro Amado
Direção de Fotografia: Renan Gomes
Direção de Arte: Janaína Matos
Light Designer: Alexandre Augusto
Iluminação: Spectrum Design
Assistente de Produção: Bruno Guiol, Débora Sena
Assistente de Direção: Robison Soares
Op de Câmera: Amarelo, Alan Denis, Maurício Augusto, Cícero, Nilton Lima, Carlos Santos, Iago Monteiro, Bruno Giby, Daniel Donatelli, Gustavo Gomes
Direção Técnica: Felipe Lemes
Produção Broadcast: Jakeline Neco
Técnico Broadcast: Miller Teixeira
Assistente de Câmera: Danilo Rossi, Vyctor Eduardo Maciel, Diego Rafael
Assistentes Gerais: Lucas Kubiski, Lyncoln Fernando, Daniel Gonçalves
Edição de Vídeo: Robison Soares
Colorista: Flauzilino Jr.
BTS: Lucas Nespoli, Alek Lemes, Guilherme Massone, Gabriel Vitorino
Still: Lucas Parisi, Pedro Gama
Design: Fabio Papaleo
Motion Design: Thiago Oscar
Figurinista: Alessandra Marins
Assistente de Figurino: Larissa Gasparelli
Maquiadora: Karina Bandeira
Hair Stylist: Bricia Santos

▸ Siga a Musile Records nas redes sociais:
https://www.youtube.com/musilerecords
https://www.instagram.com/musilerecords
https://web.facebook.com/musileRecords
https://www.tiktok.com/@musilerecords

▸ Siga a Sarah Beatriz nas redes sociais:
https://www.youtube.com/channel/UCNwql3VL1H62zMY_btrUjzg
https://www.instagram.com/sarahbiaa
https://www.facebook.com/sarah.beatriz.773776
https://www.tiktok.com/@sarahbeatrizoficial

▸ Siga a Bruna Karla nas redes sociais:
https://www.youtube.com/channel/UCGswK3GNF3Yeet6CnGnIv8g
https://www.instagram.com/brunakarla
https://www.facebook.com/BrunaKarlaOficial

6ruprUh@dedu, sarah beatriz, sara, bia, bruna karla, o teu poder, creio em ti, canta, todavia me alegrarei, promessas, o maior vilao sou eu, o medo não vai me parar, sarah beatriz e samuel messias, sarah beatriz mauro henrique e eli soares, cicatrizes, fenomeno, sou humano, quando eu chorar, tauren wells, jenn johnson, famous for, i believe, deus de promessas, deus grandioso, através das águas, através do fogo, canta, eu creio, tudo é possível em ti; sara beatriz cover, ao vivo, louvores, musile records;
 
#SarahBeatriz #BrunaKarla #OTeuPoder","6ruprUh@dedu, sarah beatriz, sara, bia, bruna karla, o teu poder, creio em ti, canta, todavia me alegrarei, promessas, o maior vilao sou eu, o medo não vai me parar, sarah beatriz e samuel messias, sarah beatriz mauro henrique e eli soares, cicatrizes, advogado fiel, fenomeno, sou humano, quando eu chorar, tauren wells, jenn johnson, famous for, i believe, deus de promessas, deus grandioso, através das águas, através do fogo, sara beatriz cover, ao vivo, louvores, musile records",00:05:27,21056,2507,203,https://i.ytimg.com/vi/we3d6SVqcpI/maxresdefault.jpg,BR
35,,,20,Lifestyle_(sociology),4.11%,,35,UCUp6wodtd6vPPj1ZmFfVoIQ,Taspio,4520000,B1HM14NA4uY,2025-03-12T21:40:11Z,34.98 horas,Eles Estão com Medo de Dormir Sozinhos Por Causa do Palhaço,"🔵 GRUPO DO CANAL: https://ig.me/j/AbYdeyVaitcqAd0L/

🟣 LIVES : https://www.twitch.tv/taspio

🔴 CANAL DE CORTES : https://www.youtube.com/@cortesdotaspio

🟡 INSTA : https://www.instagram.com/taspio/

❤️ Use code ''TASPIO'' na loja de itens do Fortnite

👉 Seja MEMBRO e Ajude a Apoiar o Canal (membros não da acesso a vídeos antecipados)
https://www.youtube.com/channel/UCUp6wodtd6vPPj1ZmFfVoIQ/join

DEIXA O LIKE E INSCREVA-SE NO CANAL RAPAZIADA TMJ!!

✉️Contato: agencia.taspío@gmail.com","fortnite, taspio, season 8 fortnite, hero base",00:35:50,1335664,47778,7102,https://i.ytimg.com/vi/B1HM14NA4uY/maxresdefault.jpg,BR
36,,,20,"Music, Music_of_Latin_America, Pop_music, Lifestyle_(sociology)",7.74%,,36,UCU1Dfv7UCahezar94GH6ikw,Julia Pimentel,209000,T0p9YtZEplY,2025-03-12T21:00:20Z,35.64 horas,O CAUÃ VAI EMBORA DO BRASIL!! (falei tudo),,,00:11:44,100236,6136,1627,https://i.ytimg.com/vi/T0p9YtZEplY/maxresdefault.jpg,BR
37,,,28,"Music, Lifestyle_(sociology)",1.88%,pt,37,UC63iwP6BtIjxB6xn1GKR6Lw,Emilly Vick,23400000,MbQKaO37KXY,2025-03-12T15:00:33Z,41.64 horas,A CADA RODADA A ESPUMA AUMENTA *Batalha extrema !,"INSTAGRAM DOS ROSA (oficial) 👇
https://www.instagram.com/dosrosaof?igsh=MXV0bG92dGFhZnVtMg%3D%3D&utm_source=qr",,00:16:24,2469843,43549,2846,,BR
38,,,22,"Vehicle, Lifestyle_(sociology)",10.42%,,38,UCxLwa0GGAB9z-NevyRGHJ0g,ALEMAO DA CARAVAN,161000,NN0h5yLJPRQ,2025-03-12T21:59:35Z,34.66 horas,PRIMEIRO ROLÊ NA M5 DE 1.000CV! (FUI ENQUADRADO!),"🛑BEM VINDOS AO CANAL RAPAZIADA AQUI MOSTRO TODO MEU DIA A DIA COM MEUS CARROS/EVENTOS/PROJETOS E MUITO MAIS!

🛑VIDEO TODO OS DIAS AS 12:00

🛑SORTEIOS/MELHORES AMIGOS/CAMISETAS/INSTAGRAM TUDO NO LINK ABAIXO👇 
               
                https://linktr.ee/alemaodacaravan",,00:12:27,135723,13662,482,https://i.ytimg.com/vi/NN0h5yLJPRQ/maxresdefault.jpg,N/A
39,,,1,Lifestyle_(sociology),8.88%,pt-BR,39,UCibCu85Cu21IIN9g3cGoLjA,Edmar Silva ,23600,NHFOtHqYcj0,2025-03-12T22:00:14Z,34.65 horas,"CAFÉ COM BOSCO: A vida sem Água, sem Energia e sem Companhia","Hoje fui visitar Seu Bosco, um homem que vive sozinho no meio da mata, em uma cabana sem água, sem energia e sem companhia. A solidão e as dificuldades fazem parte do seu dia a dia, mas ele segue firme, enfrentando a vida com coragem.

Bosco preparou um café no fogo a lenha. O açúcar era pouco, e o sabor ficou levemente amargo, quase como um reflexo da realidade dura que ele enfrenta. Enquanto tomávamos o café, conversamos sobre sua rotina e sobre os desafios de viver isolado, sem o básico que qualquer pessoa merece.

Mas essa história pode mudar. Estamos em uma campanha para construir uma casinha de alvenaria para ele, um lar digno onde possa ter mais conforto e segurança. Seu Bosco já enfrentou tempo demais a solidão e as dificuldades, e agora é nossa chance de mostrar que ele não está esquecido.

Se você também acredita que ninguém deveria viver assim, junte-se a nós nessa missão. Vamos transformar a vida de Seu Bosco e dar a ele um futuro melhor!

Ajude através da chave pix celular 87981669398
Titular da conta: Edmar Alexandre Da Silva 

WhatsApp do canal (87)981669398

Endereço para envio de presentes 🎁 
Rua Quatorze De Julho 395
Bairro: cagep
Cep.56909-680 
Cidade: Serra Talhada-PE 

@ElizeuSilvaTV",,00:27:59,52539,4339,324,https://i.ytimg.com/vi/NHFOtHqYcj0/maxresdefault.jpg,BR
40,,,22,"Lifestyle_(sociology), Entertainment",3.46%,,40,UCgJnKtIMg8gv_9jTwW-EFpA,Família Oliveira,915000,LCtWHhDGnww,2025-03-12T15:00:32Z,41.64 horas,A LORRAYNE ESTÁ COM UM PROBLEMA SÉRIO - ENCONTRAMOS ELA ASSIM 😱😱😱,LORRAYNE ESTÁ COM UM PROBLEMA SÉRIO - ENCONTRAMOS ELA ASSIM 😱😱😱,,00:14:57,124106,4125,171,https://i.ytimg.com/vi/LCtWHhDGnww/maxresdefault.jpg,BR
41,,,22,"Lifestyle_(sociology), Food",18.40%,,41,UC5UTV_AyFEzql9uZXMzCI5A,Zé Alvarenga,238000,2e3ZIjeC27s,2025-03-12T21:09:57Z,35.48 horas,CONSEGUI REALIZAR UM GRANDE SONHO DO MEU PAI ❤️,"Compre seus produtos ortopédicos na CASA SAÚDE (parceira DELLAMED): https://www.casasaude.com.br/

🚨Se inscreva no canal do meu pai: @alvarengacadeirante2035

🚨Use o cupom JOSE na Growth Suplementos: https://www.gsuplementos.com.br

🚨Use o cupom ALVARENGA em toda a loja INSIDER: https://www.insiderstore.com.br

🚨Baixe o App Nomad e use o código ANABOCHI20: https://nomad.onelink.me/wIQT/ANABOCHI20

E aí pessoal, belê? Não esqueçam de inscreverem-se no canal e deixarem o like! Um abração e até o próximo!

Contato: josealvarengan@gmail.com","ze alvarenga, jose alvarenga, comida, fitness, transformação antes e depois, live ze alvarenga, receita, receitas, fit, testosterona, academia, musculação",00:13:52,91219,15460,1320,https://i.ytimg.com/vi/2e3ZIjeC27s/maxresdefault.jpg,BR
42,,,10,"Music, Music_of_Asia, Lifestyle_(sociology), Pop_music",9.71%,en,42,UCNYi_zGmR519r5gYdOKLTjQ,JENNIE,14000000,XD00TJ-6WSw,2025-03-12T15:00:44Z,41.64 horas,JENNIE - like JENNIE (Official Live Performance Video l NPOP LIMITED EDITION - SIDE A),"Official live performance video for “like JENNIE” from the album ‘Ruby’ out now: https://jennie.lnk.to/ruby

NPOP LIMITED EDITION - SIDE A

Follow JENNIE -
Instagram: https://www.instagram.com/jennierubyjane
TikTok: https://www.tiktok.com/@jennierubyjane
Twitter: https://twitter.com/jennierubyjane
https://jenn.ie

Follow JENNIE HQ -
Instagram: https://www.instagram.com/jennie_hq
TikTok: https://www.tiktok.com/@jennie_hq
Twitter: https://twitter.com/jennie_hq

#JENNIE #Ruby #likeJENNIE","JENNIE, Jennie Kim, JENNIE MV, JENNIE Solo, ZEN, Ruby, JENNIE Ruby, Mantra, JENNIE Album, JENNIE New Music, JENNIE New Song, This That Pretty Girl Mantra, 제니, JENNIE Mantra, JENNIE from BLACKPINK, BLACKPINK, BLACKPINK JENNIE, Dance, Fashion, K-Pop, KPop, BLINKs, OA, OddAtelier, Odd Atelier, Love Hangover, Love Hangover Lyrics, JENNIE Lyrics, like JENNIE, who wanna rock with JENNIE, JENNIE new album, Ruby Album, Like JENNIE Dance, Like JENNIE Choreo",00:02:17,2315117,218642,6255,https://i.ytimg.com/vi/XD00TJ-6WSw/maxresdefault.jpg,N/A
43,,,17,"Sport, Association_football",2.73%,pt,43,UCs-6sCz2LJm1PrWQN4ErsPw,TNT Sports Brasil,11800000,at75qWcjBcA,2025-03-12T22:13:57Z,34.42 horas,ARSENAL AVANÇA COM GOLAÇO E AGREGADO HUMILHANTE NA CHAMPIONS | ARSENAL 2 X 2 PSV,"Após vencer por 7 x 1 na ida, o Arsenal jogou o necessário pra avançar pras quartas da Champions League! Veja os gols e melhores momentos de Arsenal 2 x 2 PSV pela Champions League!

Oferecimento: #HOCH, #BNCH, #SBCH, #BCH, #CCH, #ICH 

Crédito: Getty Images

Assista a todos os jogos ao vivo da Champions League só na Max, além de vários jogos EXCLUSIVOS do Campeonato Paulista!  https://bit.ly/48xBlJi

Acesse o portal da TNT Sports: http://www.tntsports.com.br/

Canais:
De Placa - http://bit.ly/2HxPlHl
De Sola - http://bit.ly/2k0Xg90
EI Games - http://bit.ly/2ufcveA
MFM - http://bit.ly/2KnSU6P
Cortes da TNT Sports - https://bit.ly/3hbxWHC
Cortes do Futebol Brasileiro - https://bit.ly/3aNJJwn
TNT Sports Entrevista - https://bit.ly/3xdRJOE","esporte interativo, tnt sports, tnt sports brasil, arsenal, arsenal champions, arsenal psv, arsenal psv gols, arsenal 2 x 2 psv, melhores momentos arsenal x psv, gols arsenal psv, gols champions league, melhores momentos champions league, champions league tnt sports",00:06:42,510807,13693,270,https://i.ytimg.com/vi/at75qWcjBcA/maxresdefault.jpg,BR
44,,,17,"Association_football, Sport",2.61%,pt,44,UC_oToDrJ6uca7d1dFVBmLtg,Canal GOAT,4350000,lleV_rxqxQ8,2025-03-13T21:34:04Z,11.08 horas,AL-ITTIHAD X AL-RIYADH | LIGA SAUDITA | AO VIVO E COM IMAGENS,"Divirta-se na Casa de Apostas: https://abre.ai/casadeapostas-yt (+18 jogue com responsabilidade)

O Al-Ittihad, de Karim Benzema, recebe o Al-Riyadh em partida válida pela 25ª rodada da Liga Saudita. Assista a competição ao vivo, com imagens e de graça, sempre na tela do Canal GOAT!

TUDO sobre o Canal GOAT em um só lugar: https://linktr.ee/canalgoatbr

Siga o canal de Gols do Bodinho no WhatsApp: https://whatsapp.com/channel/0029VaqqM5W4tRrxZ2sUlq3C

Já se inscreveu? Ative também as notificações para não perder nenhum lance!

▪️ Uma nova via de consumo esportivo. Inovador, disruptivo e GRÁTIS! 🐐

#alittihad #ligasaudita #benzema","canal goat, goat ao vivo, ao vivo, futebol ao vivo, futebol, futebol grátis, transmissão ao vivo, transmissão goat, LIGA SAUDITA, SAUDITA, AO VIVO, COM IMAGENS, goat, goat br, BENZEMA, sauditao, al ittihad, al riyadh, al ittihad x al riyadh assistir ao vivo, benzema, benzema gols, time benzema, al ittihad x al riyadh, jogo benzema hoje, al ittihad palpites",02:43:00,143303,3744,2,https://i.ytimg.com/vi/lleV_rxqxQ8/maxresdefault.jpg,BR
45,,,10,"Pop_music, Music, Hip_hop_music, Music_of_Latin_America",12.24%,pt,45,UCNVifsYkXq5yzylNGvi1JJA,Djonga,2440000,Vx2wnno83aY,2025-03-13T21:13:01Z,11.43 horas,06. DJONGA • MELHOR QUE ONTEM,"MELHOR QUE ONTEM é a sexta faixa do álbum ""Quanto Mais Eu Como, Mais Fome Eu Sinto!"" do Djonga. 

""Quanto Mais Eu Como, Mais Fome Eu Sinto!""  também está disponível na sua plataforma de música favorita: https://onerpm.link/QMECMFES

__________________
LETRA 

Você é quente igual o sol lá da Bahia,
nós é encontro do Rio com o mar ,
na sua pele tem sal de Caraíva,
Seus olhos são de Ogum e Iemanjá,
Não sei se eu esqueci que existe ódio,
Ou se tu me lembrou que existe amor,
Cê não tava no começo da festa,
Só sei que ficou quando ela acabou.
Sei que é bom dividir o mesmo copo,
Saber cada detalhe do seu corpo,
Torcer pro mesmo time no domingo,
E acabar em algum samba duvidoso,
Só sei que se eu pudesse eu dava um tiro,
Em cada cara que já te fez sofrer,
Sei que se eu peço a Deus pra ter bons sonhos,
Quando fecho os olhos vejo você
Só sei que fica linda com ciúmes,
Mas prefiro quando a gente se une,
E vira um, num mundinho que é só nosso,
Elas querem seu lugar se acostume,
A viver desejada,
Não importa a temporada
Meu verão, meu inverno
Meu céu, Meu inferno
Minha namorada 
Falo pouco sobre o que sinto, 
Eu só sei me expressar quando canto,
O passado me deixou mais frio,
Eu também errei não sou santo,
Sei que agora eu pareço um hipócrita,
Que só fingiu lutar pelos neguin
Eu tentei não gostar de você 
Mas cê me faz gostar mais de mim 

Já me sinto bem melhor que ontem,
E num importa as mentiras que me contem,
Se eu e você tá junto eu fico bem,

Mina Bandida virei seu refém
Já me sinto bem melhor que ontem,
E num importa as mentiras que me contem,
Se eu e você tá junto eu fico bem,
Mina Bandida virei seu refém

Vou reclamar da vida com você 
Falar mal dessa gente tosca ao lado ,
Quem conversa pelo olhar se vê,
Sei que odeia saber do meu passado,
E ultimamente eu só penso no futuro,
vários filho, 3 cachorro e um gato ,
Tu já sabe que eu não gosto de bicho,
Mas um pedido seu é jogo baixo 
Se eu te vejo passando jogo um beijo,
Se me vêem passar cê tá do lado,
De novo acordei com o braço dormente,
Cê fez de travesseiro acolchoado !
Quem diria que ia durar tanto, 
O começo foi mais que inusitado,
desesperei quando cheguei em casa,
E vi que seu Instagram é fechado,
Só queria deitar e olhar sua foto,
E pensar se eu ia te ver denovo
Mas o que o mundo tinha a oferecer 
parecia melhor e eu sou tão novo, 
até o dia que me pediu coragem 
sabe que eu sou movido a desafio,
E hoje até quem me vê,
Na fila do pão, lendo jornal,
Sabe que eu te encontrei 

Já me sinto bem melhor que ontem,
E num importa as mentiras que me contem,
Se eu e você tá junto eu fico bem,
Mina Bandida virei seu refém

Já me sinto bem melhor que ontem,
E num importa as mentiras que me contem,
Se eu e você tá junto eu fico bem,
Mina Bandida virei seu refém


__________________
FICHA TÉCNICA 

Composição: Djonga, Rapaz do Dread e Rodrigo Amarante
Letrista: Djonga e Rodrigo Amarante
Sample: Último Romance - Los Hermanos 
Produção musical: Rapaz do Dread
(Instrumentos: Piano, Teclado, Baixo Synth, Guitarra e Violão)
Eng. de Gravação: Rapaz do Dread
Mixagem e Masterização: Arthur Luna
Fotografia: Coniiin
Direção: Coniiin e Djonga
Ass. de fotografia: Mendes
Direção de arte: Djonga, Iulle Pieroni, André Martins e Daniel Bowie 
Produção Executiva: Djonga e Luiza Alves de Brito
Ass. de produção: Pedro Marques, Léo Psicopapa, Lucas Andrade, Daniel Paulo
Making off: Iulle Pieroni e Mendes
Maquiagem: Brenda Tavares
Identidade Visual: Mateus Acioli
Comunicação e Marketing: Andressa Sgarzi | Moving
Distribuição: One RPM
Realização: A Quadrilha

#Djonga #MELHORQUEONTEM #QMECMFES 

REDES SOCIAIS:

Instagram: https://www.instagram.com/djongador
Facebook: https://www.facebook.com/DjongaDV
TikTok: https://www.tiktok.com/djongador

INSCREVA-SE NO CANAL!","djonga, quanto mais eu como mais fome eu sinto, rap, hip hop, djongador, djonga day, melhor que ontem",00:03:36,34561,4043,187,https://i.ytimg.com/vi/Vx2wnno83aY/maxresdefault.jpg,N/A
46,,,17,"Sport, Association_football",6.95%,pt-BR,46,UCkPxmeuHR2EJR8DJpX8utMQ,JB Filho Repórter,381000,E0q8DPGaH1A,2025-03-13T02:07:25Z,30.53 horas,🔵 TEM UMA COISA MUITO GRAVE ACONTECENDO NO GRÊMIO!,"Entra na KTO por aqui: https://www.kto.bet.br/registro/?promoCode=JBFILHO

Deixa teu like e te inscreve no canal!
#gremio #inter

E-mail: contato@jbfilhoreporter.com.br

Hei, já conhece o meu blog? Entra lá: https://jbfilhoreporter.com.br/

Aproveita e vai no Instagram: https://www.instagram.com/jbfilhoreporter/","grêmio, jb filho, copa do brasil",00:13:02,87633,5350,738,https://i.ytimg.com/vi/E0q8DPGaH1A/maxresdefault.jpg,BR
47,,,22,"Religion, Lifestyle_(sociology), Society",17.32%,pt-BR,47,UCaFiZQHcM5cF3t6Q2xXaZ0w,Irmão José Lino,122000,GBaGlnadwcc,2025-03-12T15:06:56Z,41.53 horas,Comprando os Materiais Que ainda Faltavam Para a Casa Nova,"📌 Sobre o Canal:
Olá! Meu nome é José Lino, sou de Moçambique 🇲🇿. Aqui no canal, compartilho minhas experiências diárias, respondo perguntas e trago curiosidades sobre Moçambique e muito mais!

📩 Contato:
📧 E-mail: contactojoselino@gmail.com

🔔 Inscreva-se e ative o sininho para não perder os próximos vídeos!",8991@Joselino,00:13:26,131172,21036,1680,https://i.ytimg.com/vi/GBaGlnadwcc/maxresdefault.jpg,BR
48,,,17,"Association_football, Sport",2.26%,pt-BR,48,UCZiYbVptd3PVPf4f6eR6UaQ,CazéTV,18300000,QX-1q4PhRG0,2025-03-11T03:34:40Z,77.07 horas,JOGO COMPLETO: PALMEIRAS X SÃO PAULO | SEMIFINAL | PAULISTÃO 2025,"VALE VAGA NA FINAL!

Assista, AO VIVO E COM IMAGENS, ao clássico entre Palmeiras x São Paulo, válido pela semifinal do Paulistão 2025!

E para esse jogaço a equipe da CazéTV vem escalada com Luisinho na narração, Casimiro, Ju Cabral, Marcos Assunção e Souza nos comentários!

#PaulistãoNaCazéTV","CazéTV, Cazé TV, Casimiro ao vivo, Casimiro, CazéTV ao vivo, Cazé ao vivo, cazetv, casimiro jogos, caze tv ao vivo, melhores momentos, jogo ao vivo, assistir futebol, jogo palmeiras, assistir palmeiras, palmeiras ao vivo, palmeiras paulistao, paulistao ao vivo, jogo sao paulo, assistir sao paulo, sao paulo ao vivo",05:13:20,16794211,379803,194,https://i.ytimg.com/vi/QX-1q4PhRG0/maxresdefault.jpg,BR
49,,,24,"Video_game_culture, Entertainment, Film",14.27%,pt,49,UCb792SuaObwn3k8IA-vhFQw,Drawn Mask,4430000,pNDJPvg5wRE,2025-03-12T15:01:23Z,41.63 horas,Oi... Podemos conversar? Futuro do canal,"primeiro video de thumb preta, podemos conversar? queria tirar isso do peito...

Odisseia do Sol: https://linktr.ee/odisseiadosol

Twitter: https://twitter.com/drawn_mask
Instagram: https://www.instagram.com/drawn_mask/

Thumb Desenhada feita por:
https://x.com/CamieGum

Contato: drawnmask@linkme.live","drawn, tales, mask, história, animação, desenho, desenhado, adolescente, animado, divertido, bonitinho, fofo, engraçado, drawnmask, drawtales, drawmask, animada, histórias, de, vida, vlog, contador, conta, dublado, desenhista, referencia, referencias, meme, thumb, escura, conversar, temos que conversar, podemos conversar, mudança, futuro do canal",00:04:42,170101,23464,815,https://i.ytimg.com/vi/pNDJPvg5wRE/maxresdefault.jpg,BR
50,,,17,"Association_football, Sport",16.36%,pt-BR,50,UCnEqBKumGOBp5e6_UMosA1A,Canal do Perinão,72400,WZ2v_YQDSLA,2025-03-13T02:59:40Z,29.66 horas,CORINTHIANS 2 x 0 BARCELONA-EQU - ELIMINADOS(DE NOVO) NA PRÉ-LIBERTADORES! | PÓS-JOGO,"E aí seus faixa preta, vocês tão bão?

Tristeza!

Se inscreva no meu novo canal:
https://www.youtube.com/@PERINANDOO

Quer interagir comigo? Parcerias? Patrocínios? 
Me chama no insta: https://instagram.com/canaldoperinao ou envie email para: thiagoperinao@gmail.com

Quer ajudar o canal? 
Seja membro deste canal e ganhe benefícios:
https://www.youtube.com/channel/UCnEqBKumGOBp5e6_UMosA1A/join
Pix para doações:: thiagoperinao@gmail.com

____________________________________________________
Parcerias: 

Antecipe agora seu FGTS com a + Ágil:
https://contate.me/antecipeseufgts01

Doe para ajudar na quitação da Arena do Corinthians: 
https://www.doearenacorinthians.com.br/

Aprenda a tocar violão em apenas 3 passos! Aproveite a oferta por tempo limitado:
https://secure.doppus.com/sale/SZ3BJ0OEZ3BJ0OE50390O
____________________________________________________

Obrigado e volte sempre! Tmj

#corinthians","canal do perinão, perinão, futebol, palpites, lances, react, brasileirão, gols e lances, melhores momentos, pós jogo, corinthians, posjogo corinthians, jogos de hoje, react jogos, react futebol, canal do corinthians, react corinthians, canal de react, corinthians pós-jogo, corinthians gols, corinthians analises, corinthians react, meu timão, decimo 14, canal do povo escolhido, papo fiel",00:15:36,32281,4400,881,https://i.ytimg.com/vi/WZ2v_YQDSLA/maxresdefault.jpg,BR
