Posicao na coleta,Gênero do vídeo,Tipo de produtor,Categoria do vídeo,guideCategory,Taxa de engajamento,Idioma,Posicao Geral,Id do canal,Canal,Inscritos no canal,Id do vídeo,Data de publicação,Diferenca de horas entre postagem e coleta,Título do vídeo,Descrição do vídeo,Tags do video,Duração do vídeo,Visualizações,Gostei,Comentários,thumbnail_maxres,Pais
1,,,10,"Music_of_Latin_America, Country_music, Music, Christian_music",1.29%,pt-BR,1,UCYqS6dXzdxhLcqOl9ci4J6g,YANCA VALLEN,2220,QPuoZA1CZTY,2026-06-27T09:00:06Z,60.24 horas,Era Deus e Eu | Yanca Vallen | Country Gospel Oficial,"Quando todos se afastaram, Deus permaneceu.

""Era Deus e Eu"", de Yanca Vallen, é uma canção country gospel sobre os momentos em que a solidão parecia maior que a esperança, mas a presença de Deus nunca deixou de sustentar.

Se esta música falou ao seu coração, compartilhe com alguém que precisa lembrar que Deus nunca abandona os Seus filhos.

🙏 Deixe nos comentários: Em qual momento da sua vida você percebeu que era Deus cuidando de você?

🔔 Inscreva-se no canal e ative as notificações para acompanhar os próximos lançamentos.

Que esta canção fortaleça sua fé e renove sua esperança.

🎵 Música: Era Deus e Eu
🎤 Artista: Yanca Vallen

#CountryGospel #YancaVallen #EraDeusEEu #Louvor #MusicaGospel #Fe #Deus #Adoracao #GospelBrasil #CountryCristao #JesusCristo #Esperanca #Louvor2026 #MusicaCrista #Evangelho","Era Deus e Eu, Yanca Vallen, country gospel, country cristão, música gospel, louvor gospel, louvor, adoração, música cristã, gospel brasileiro, country gospel brasil, sertanejo gospel, fé em Deus, Jesus Cristo, Deus nunca abandona, Deus cuida de mim, canção de fé, louvor emocionante, música para oração, música para chorar, louvor 2026, gospel 2026, música evangélica, adoração cristã, música country feminina, country worship, música de esperança, louvor que toca a alma",00:07:43,20399,260,4,https://i.ytimg.com/vi/QPuoZA1CZTY/maxresdefault.jpg,BR
2,,,1,"Entertainment, Film",3.71%,en-US,2,UCU4SM3j_9TNWaSu8KdGV50g,Focus Features,1050000,cmjpadVj-Vk,2026-06-29T12:00:12Z,9.24 horas,WERWULF - Official Trailer [HD] - Only In Theaters Christmas,"Do not dread the darkness. Embrace it. Robert Eggers' WERWULF is only in theaters this Christmas.

Witness Robert Eggers’ most visceral and haunting experience yet. Focus Features presents WERWULF, a harrowing tale of devotion, damnation and the devil within.

https://werwulffilm.com/
Instagram: https://www.instagram.com/werwulfmovie/
Facebook: https://www.facebook.com/werwulfmovie
Twitter: https://x.com/werwulfmovie

Subscribe to Focus Features: http://bit.ly/FocusFeaturesYouTube

Become a Focus Insider: https://insider.focusfeatures.com 

Website: https://www.focusfeatures.com
Instagram: https://www.instagram.com/focusfeatures
Facebook: https://www.facebook.com/focusfeatures
Twitter: https://twitter.com/focusfeatures","Focus Features, Robert Eggers, Sjón, Chris Columbus, Eleanor Columbus, Eric Fellner, Tim Bevan, Garrett Bird, Aaron Taylor-Johnson, Willem Dafoe, Lily-Rose Depp, Ralph Ineson, Nosferatu, Werwulf Film, Werwulf, Werwulf Movie, Bodhi Rae Breathnach, Vidal Arzoni",00:02:15,2147667,73918,5715,https://i.ytimg.com/vi/cmjpadVj-Vk/maxresdefault.jpg,US
3,,,20,"Action_game, Video_game_culture, Action-adventure_game, Role-playing_video_game",11.29%,pt-PT,3,UCIXguhHCl8eDTkXpEuiGPUA,Jazzghost,24100000,WmMSe6QiY1g,2026-06-29T15:00:02Z,6.24 horas,O VÍDEO DE MINECRAFT MAIS ASSUSTADOR DE 2026!,"No vídeo de hoje eu vou jogar um Modpack chamado Dread Reborn, que adiciona várias criaturas bizarras famosas de uma só vez no Minecraft! CONFIRA E SARAIVA O LIKE!
●Nome do Jogo: Minecraft (Modpack: Dread Reborn)
======================
●Instagram: julianoab
●Email de contato: comercial@agenciacurta.com","jazzghost, jazz, minecraft, mod, modpack, dreadreborn",00:34:10,496820,51786,4297,https://i.ytimg.com/vi/WmMSe6QiY1g/maxresdefault.jpg,N/A
4,,,10,"Music, Music_of_Latin_America, Pop_music",0.49%,pt-PT,4,UCm6Kk_E9qUcPEEAiwsOzzXQ,Zé Neto & Cristiano - Topic,5990,6T4PcGmhR7I,2026-06-27T10:00:08Z,59.24 horas,Notificação Preferida (Ao Vivo),"Provided to YouTube by Sony Music Entertainment

Notificação Preferida (Ao Vivo) · Zé Neto & Cristiano

Top Brasil 2026 - As Melhores e Novidades

℗ 2020 Som Livre

Released on: 2026-06-28

Associated Performer: Zé Neto & Cristiano
Lead Vocalist: Various Artists
Composer: Junior Gomes
Composer: Vine Show
Composer: Thiago Alves
Composer: Samuel Alves
Producer: Not Applicable

Auto-generated by YouTube.","Zé Neto & Cristiano, Top Brasil 2026 - As Melhores e Novidades, Notificação Preferida",00:03:03,26307,129,0,https://i.ytimg.com/vi/6T4PcGmhR7I/maxresdefault.jpg,N/A
5,,,20,"Action_game, Role-playing_video_game, Video_game_culture, Action-adventure_game",17.45%,en,5,UC4zyoIAzmdsgpDZQfO1-lSA,Cyberpunk 2077,1820000,mV7451mcw-E,2026-06-29T15:30:07Z,5.74 horas,Cyberpunk: Edgerunners 2 | Official Teaser 2,"Look alive, choom — Cyberpunk: Edgerunners 2 is coming your way this Fall!

Gear up for a return to the world of Cyberpunk, where only the ruthless survive and one wrong move can get you flatlined. This standalone story throws a fresh cast of characters into the darkest corners of Night City and brings a raw, gritty take on the world of the future. Lawless and unforgiving, this is Night City at its most brutal. 

Brought to you by CD PROJEKT RED and TRIGGER, Cyberpunk: Edgerunners 2 is directed by Kai Ikarashi (Cyberpunk: Edgerunners, SSSS.Gridman), with Kanno Ichigo (Promare, Cyberpunk: Edgerunners) as the lead designer and Hugo Award winner Bartosz Sztybor as showrunner, story writer, and producer.

TRAILER MUSIC
Original Score by Tsuneo Imahori
“You Can't Run From Me” — written by Maria Kelly and Drew Polovick, performed by Rico Nasty, produced by Drew Polovick, mixed and mastered by Elliot Polokoff

Coming to Netflix, Fall 2026. 

Stay connected:
cyberpunk.net/edgerunners2
x.com/edgerunners
facebook.com/edgerunners
instagram.com/Edgerunners

Want to experience Night City on a deeper level? Play Cyberpunk 2077 and carve your own path through the dark future.",,00:01:31,1202152,199944,9786,https://i.ytimg.com/vi/mV7451mcw-E/maxresdefault.jpg,PL
6,,,10,"Music, Pop_music, Hip_hop_music, Christian_music, Music_of_Latin_America",2.06%,pt-PT,6,UCzjS0ukSt5Sa08JtTsIaNOQ,Izael Lopes - Topic,5,kLa5rIqSkhc,2026-06-29T03:52:59Z,17.36 horas,Espírito santo de Deus,"Provided to YouTube by DistroKid

Espírito santo de Deus · Izael Lopes · Jackson Pires Braz

Espírito santo de Deus

℗ Consciente1

Released on: 2026-06-28

Auto-generated by YouTube.","Izael Lopes, Jackson Pires Braz, Espírito santo de Deus",00:03:33,15048,310,0,https://i.ytimg.com/vi/kLa5rIqSkhc/maxresdefault.jpg,N/A
7,,,20,"Puzzle_video_game, Video_game_culture, Action_game, Action-adventure_game",13.94%,ru,7,UCgPzex5BESpqUXxkeQGftgQ,Occulta Studio,20100,VGox4n7llOA,2026-06-29T17:00:06Z,4.24 horas,Poppy Playtime: Remake - Official Game Trailer 1,"Poppy Playtime: Remake - Official Game Trailer 1

The goal of this trailer is to show how much the graphics have improved since the second gameplay video and get feedback

Our Discord Server:  https://discord.gg/QqbbPxQkJ 
Game link:  https://gamejolt.com/games/pptremake/1010130
Game link 2: https://occulta-studio.itch.io/pptr
Our Twitter: https://x.com/OccultaStudio

Poppy Playtime: Remake is a fan project created with one goal: to breathe new life into the legendary first chapter and show what passionate fans are capable of.

We're not just porting the game to a new engine. Our mission is to enhance the original, preserving its soul while adding everything the community believes could make the Playtime Co. factory even more immersive and terrifying

Original game made by Mob Entertaiment: https://store.steampowered.com/app/1721470/Poppy_Playtime/

#poppyplaytime","poppy playtime, huggy wuggy, poppy playtime chapter 1, poppy playtime chapter 5, poppy playtime chapter 5 trailer, poppy playtime animation, poppy, kissy missy, catnap, smiling critters, poppy playtime chapter 4, poppy playtime chapter 5 gameplay, poppy playtime chapter 1 full gameplay, Yarnaby, #poppy playtime chapter 6",00:01:26,75397,9511,1001,https://i.ytimg.com/vi/VGox4n7llOA/maxresdefault.jpg,US
8,,,20,"Role-playing_video_game, Video_game_culture, Action-adventure_game, Action_game",3.40%,pt-BR,8,UCrcBZDofBltcgGxphNia2tw,ProbIems,12200000,OKi4wS3zqUM,2026-06-29T13:00:15Z,8.24 horas,Entrei no Servidor de MINIWAR no Minecraft!,"Servidor de discord:
https://discord.gg/2jtYumJKuZ

Minha Loja:
https://www.curtaloja.com/marca/problems.html

Contato COMERCIAL:
comercial@agenciacurta.com

Segue a turma no instagram:

Problems💙 https://www.instagram.com/problems_sr/
Mel 💛https://www.instagram.com/kaikemel/
Kadu 💖 https://www.instagram.com/kadukon/
Stick 💚https://www.instagram.com/guualfaro/
Zoom 🧡 https://www.instagram.com/josedu4rd/

ATENÇÃO: O conteúdo do vídeo é 100% family friendly, ou seja qualquer um pode assistir com toda a familia quando quiser!!

#problems #minecraft","maniqueft, lego, problems, probrems, probres, pobrems, problemas, problema, pobrema, mainequeft, minecraft, video do problema, video do problems, video do pobrems, minecraft survival, minecraft mitos, minecraft fatos, problems roblox, roblox, pobrems roblox, pobris roblox, pobrema roblox, problema roblox",00:17:11,193431,6198,376,https://i.ytimg.com/vi/OKi4wS3zqUM/maxresdefault.jpg,BR
9,,,10,"Music_of_Latin_America, Music",0.85%,pt-BR,9,UCGYJlreupVYnDwaARORyVSw,Dodô Diplomata,431000,r3HASZn-xO4,2026-06-25T21:31:26Z,95.72 horas,Mtg Brasil a Seleção Chegou Brasil Com S,,,00:02:32,52067,434,11,https://i.ytimg.com/vi/r3HASZn-xO4/maxresdefault.jpg,BR
10,,,20,"Strategy_video_game, Action_game, Video_game_culture, Action-adventure_game, Role-playing_video_game",6.73%,en-US,10,UC-2Y8dQb0S6DtpxNgAKoJKA,PlayStation,17200000,JjpJ2xwUagM,2026-06-29T01:40:09Z,19.57 horas,Marvel Tōkon: Fighting Souls - Samurai Outriders Trailer | PS5 & PC Games,"https://www.playstation.com/games/marvel-tokon-fighting-souls/

Samurai Outriders slash their way through MARVEL Tōkon: Fighting Souls!

The fifth and last team to enter the Challenge of the Champion is led by Robbie Reyes as Ghost Rider, and features three new playable characters: Blade, Deadpool and Loki!

The ultimate squad of anti-heroes is stepping into MARVEL Tōkon: Fighting Souls to prove themselves!

MARVEL Tōkon: Fighting Souls is coming to PS5 and PC on August 6th, 2026 PT!

Follow us for all the latest updates:
Twitter: https://x.com/MARVELTokon
BlueSky: https://bsky.app/profile/marveltokon.bsky....
Facebook: https://www.facebook.com/MARVELTokon/
Instagram: https://www.instagram.com/marveltokon/
TikTok: https://www.tiktok.com/@marveltokon

© 2026 MARVEL
©2026 Sony Interactive Entertainment Inc.
Developed by ARC SYSTEM WORKS CO., LTD.

#ps5 #ps5games #marveltokon","PlayStation, PS5, video games, next gen, Sony, Marvel, Marvel Tokon, Samurai Outriders, Ghost Rider, Deadpool, Loki, Blade, Fighting Game, FGC, Arc System Works",00:02:43,538459,33651,2608,https://i.ytimg.com/vi/JjpJ2xwUagM/maxresdefault.jpg,US
11,,,17,"Video_game_culture, Sport, Association_football",1.80%,pt-PT,11,UCL2dRKzGhAi3RNb54FeEtKA,Simulação 90,2050,HzopH1cw_zo,2026-06-28T14:30:45Z,30.73 horas,BRASIL x JAPÃO | COPA DO MUNDO 2026 | PES 2021,"🏆 BRASIL x JAPÃO | COPA DO MUNDO 2026 | PES 2021

Confira esta simulação completa de Brasil x Japão pela fase de grupos da Copa do Mundo FIFA 2026 no PES 2021!

🔥 Neymar e companhia entram em campo em busca da vitória.
⚽ Será que o Brasil vai confirmar o favoritismo ou Japão vai surpreender?
🏟️ Simulação realizada no PES 2021 com atualização da Copa do Mundo 2026.

👉 Deixe seu palpite nos comentários!
👍 Não esqueça de deixar o like.
🔔 Inscreva-se no canal para mais simulações da Copa do Mundo 2026.

#Brasil #japão #CopaDoMundo2026 #WorldCup2026 #PES2021 #eFootball #Simulacao #FIFAWorldCup #Brazil #Neymar #Football #Gameplay #CanalDeFutebol #Futebol #kubo",,00:16:53,93178,1463,214,,BR
12,,,10,"Pop_music, Music_of_Latin_America, Music, Hip_hop_music",5.41%,pt-PT,12,UCZL1lbHuNDqhmbCpCiQLYDQ,DJ 2W,11500,t8Cch20Zuj8,2026-06-26T21:00:06Z,72.24 horas,"Set do DJ 2W 04 - MC Braz,  MC Rick, MC L da Vinte, MC Josh, Mc Kaio, MC Luan da BS, Mc DB","Musica: Set do DJ 2W 04 
Artistas: MC Braz,  MC Rick, MC L da Vinte, MC Josh, Mc Kaio, MC Luan da BS, Mc DB 

LETRA:

Set DJ 2W 04
MC JOSH

Baby girl, tu me ganhou tão fácil,
Apelação sobre ser gostosa de rosto.
Beldade atingiu a perfeição.

No feed pela For You, quem é a que ganhou vilão?
Dá um play no Set do 2W.
Combinação perfeita essa gostosa, meu mano.

Chapada de ice,
Hum, hum,
Dando um sentadão.

Ficou grudado o cheiro doce da B,
Mexeu com a imaginação,
Ganhou o vilão.

De bonde com as amiga,
Essa gostosa jogando.
No baile de gueto,
Hum, hum,
Dando um sentadão.

Ficou grudado o cheiro doce da B,
Mexeu com a imaginação,
Ganhou o vilão.

De bonde com as amiga,
Essa gostosa, meu mano.
No baile de gueto,
Hum, hum,
Dando um sentadão.

Ficou grudado o cheiro doce da pele,
Mexeu com a imaginação,
Ganhou o vilão.

MC BRAZ

Olha nós aí de novo,
Com as melhores, essa gang é um absurdo.
Se 3 é bom, 4 delas vai ser o mundo.
E a cada Set mais mulher, eu acho justo.

E eu não vivo sem farra, sem ela, sem bailão.
Set 4 vindo aí pra curar a depressão.
Vou pedir pra ela descer, diz que sim, diz que não.

Mas se quicar gostosinho vai ganhar meu coração.
Eu nunca vi amar favela igual a patricinha ama.
Vira a garrafa e fica com fogo na tcheca, tcheca.

Toda vez que o 2W chama,
Eu vou brotar mesmo que eu entre de penetra,
Só pra machucar essa piranha.

Vira a garrafa e fica com fogo na tcheca, tcheca.
Toda vez que o bonde te chama,
Toda vez que o 2W te chama.

MC KAIO

Me sinto na obrigação de te deixar leve,
Você sabe minha intenção, também sei o que você quer,
O que as outras querem.

Gemendo alto em bom tom, escutando o Set.

Já podia imaginar que tu sentava tão bem,
Tu veio pra confirmar.

Deixa eu machucar, sua xota, perversa,
Só pra relembrar.
Arrastar ela, arrastar ela,
Desce a perereca, desce a perereca.

Deixa eu machucar, sua xota, perversa,
Só pra relembrar.
Arrastar ela, arrastar ela,
Desce a perereca, desce a perereca.

MC LUAN DA BS

Eu sempre falo com 2W que as bandida é diferente.
Elas não querem só os milionários, tão querendo os delinquentes.
Bem trajado, perfumado, com a mente pra frente.
Elas sabem que eu pego o bolado e o ritmo é diferente.

Olha a vida que nós leva, vida de favela.
E a Jack de milho não pode faltar por nada.
E se a bunda dela balança, é aí que ela dança.
Novinha só quer zoar.

Rebola me olhando aqui no Set do 2W.
Zero love, agora é sentimento congelado.
Comentou que eu tava rico no set passado.
Calcular de novo, agora o pai tá milionário.

Rebola me olhando aqui no Set do 2W.
Zero love, agora é sentimento congelado.
Comentou que eu tava rico no Set passado.
Calcular de novo, agora o pai tá milionário.

MC RICK

Bloco da tchuca presente,
Alegrando o nosso baile apenas com a beleza.
No beat do 2W, eu canto, desce, maldadeza.
Beefeater no seu copo,
Acaba rápido igual água.
Meio de semana treinando, ela limpa toda a cachaça.

Mas não para e nem dá o tempo,
Não para e nem dá o tempo.
Brota na festa e se acaba,
Ela sabe o procedimento.

Ela não para e nem dá o tempo,
Não para e nem dá o tempo.
Agacha na academia, agacha no pau do Nelso.

Sucesso, Set do 2W na boca do povo.
Nem um pouco de discreto, até no meu dente eu pus ouro.
Sucesso, só quando eu toca o funk de BH que ela dança.
Não é à toa que nós domina a playlist das piranhas.

Sucesso, Set do 2W na boca do povo.
Nem um pouco discreto, até no meu dente eu pus ouro.
Sucesso, só quando eu toca o funk de BH que ela dança.
Não é à toa que nós domina a playlist das piranhas.

MC L DA VINTE

Quem te comeu foi eu.
Tá apaixonada e o problema é seu.
Para de procurar o que tu não perdeu.
Não fica magoada se nóis só fudeu.

E tenta ser minha favorita.
Sobe o morro e desce pra pista.
Me sinto melhor, como você e sua amiga.
Nóis só paga à vista, mas tu dá uma dividida.
Mesmo eu não sendo seu, mesmo tu sendo minha.

Deixa ela arrastar, deixa que a raba balança.
Deixa ela arrastar, muito whisky e maconha.
Pra te ver descer, pra te ver doidona.
Chama essas piranha, chama essas piranha.

Deixa ela arrastar, deixa que a raba balança.
O Set do 2W é muito whisky e maconha.
Pra te ver descer, pra te ver doidona.
Chama essas piranha, chama essas piranha.

MC DB

Nóis vai por fogo na festa, encher o carro de puta.
Esse é o Set do 2W, manda o beat pra elas.

Só pra matar a saudade, madruga bonita, quer um after.
Brotou com as amigas gostosas, rolou troca de olhares.
Já reboquei na hora,
E dançar assim, pra mim, ela é um perigo.
Faz tempo que eu tô a fim de transar contigo.
Linda no Insta, melhor ao vivo.

Se ela me olhar de novo,
Assim eu tô perdido.
Porque o olhar da danada hipnotizou.

De novo o 2W foi lá e me aconselhou.

Foda que ela é tão gostosa,
Isso mexe com o meu coração.
Da hora pra te ver descer.

Porque o olhar da danada me hipnotizou.
De novo o 2W foi lá e me aconselhou.
Foda que ela é tão gostosa,
Isso mexe com o meu coração.

Da hora pra te ver descer com esse rabão.","MC Braz, MC Rick, MC L da Vinte, MC Josh, Mc Kaio, MC Luan da BS, Mc DB, Set do DJ 2W 04, DJ 2W",00:07:06,17268,850,85,https://i.ytimg.com/vi/t8Cch20Zuj8/maxresdefault.jpg,N/A
13,,,24,"Film, Entertainment, Lifestyle_(sociology)",12.14%,pt,13,UCiGdqYoOmoWjiFehl5gcJFQ,Dear Maidy,1870000,uOa8dw4XHvw,2026-06-28T16:05:16Z,29.15 horas,DESCENDENTES 5: CHLOE É A VILÃ?! 👀 - ANÁLISE do TRAILER FINAL,"A Chloe vai ser a grande vilã de Descendentes 5? vem conferir todas pistas e segredos escondidos no trailer final de Descendentes 5

✨ CONHEÇA 'O DIÁRIO DE UMA PRINCESA DESASTRADA': 
https://amzn.to/3ORozwC

⭐️ Não se esqueça de se INSCREVER e ativar O SININHO, para apoiar o canal! 

✨ Minha coleção de camisetas ⤵
http://bit.ly/MAIDYlolja

VEM SEGUIR NAS REDES SOCIAIS ⤵
🎮 Lives de seg á sexta ás 18h: https://bit.ly/LivesDaMaidy
📸 Instagram: http://instagram.com/dearmaidy @dearmaidy
🐦 Twitter: https://twitter.com/DearMaidy @dearmaidy
📱 Tiktok: @DearMaidy

📧 CONTATO PROFISSIONAL:
comercial@maidy.com.br 

© Todas as reproduções audiovisuais presente no vídeo, como filmes, séries, jogos são marcas registradas dos seus respectivos proprietários. Este vídeo não tem o objetivo de distorcer o conteúdo da obra, mas de propagar, divulgar e expandir o universo do objeto em questão.",,00:19:12,42546,4757,407,https://i.ytimg.com/vi/uOa8dw4XHvw/maxresdefault.jpg,BR
14,,,20,"Sport, Sports_game, Video_game_culture",1.34%,pt-BR,14,UCSQAtZWBKis70w7lR2UmRRw,ZR_Gaming,18100,7t1th562VH8,2026-06-27T18:00:38Z,51.23 horas,BRASIL x JAPÃO | COPA DO MUNDO FIFA™ 2026 | SEGUNDA FASE | PES2021 Gameplay 4k,"Simulação de Brasil x Japão pela Copa do Mundo FIFA 2026 no PES 2021

🚨 ATENÇÃO: ISSO É UMA SIMULAÇÃO FEITA NO JOGO PES 2021 VERSÃO COMPUTADOR 🚨 

🔹Obrigado Por Assistir 
👉 Se Inscreva no Canal
👍 Deixe seu Like
🗨️ Deixe Comentários ou sugestões
🔁Compartilhe
        
PES 2021 (GamePlay PC) 4K 60 FPS PATCH GOGOSZ eFootball PES 2021

#gogosz #bmpes #efootball2026 #pes2021 #copadomundo2026","Brasil, Japão, Copa do Mundo 2026, Pes 2021 Gameplay",00:21:18,113030,1408,107,https://i.ytimg.com/vi/7t1th562VH8/maxresdefault.jpg,BR
15,,,10,"Pop_music, Music_of_Latin_America, Music",0.68%,pt-PT,15,UCt7gEkoYX31_jHT6RH7rgCA,Cristiano Araújo - Topic,16500,0g3WU6ZLOa0,2026-06-27T10:00:35Z,59.23 horas,Caso Indefinido (Ao Vivo),"Provided to YouTube by Sony Music Entertainment

Caso Indefinido (Ao Vivo) · Cristiano Araújo

Top Brasil 2026 - As Melhores e Novidades

℗ 2021 Som Livre

Released on: 2026-06-28

Associated Performer, Lead Vocalist: Cristiano Araújo
Composer: Maraisa
Composer: Thalles Lessa
Composer: Diego Damasceno
Composer: Paulo
Composer: Júnior
Producer: N/A

Auto-generated by YouTube.","Cristiano Araújo, Top Brasil 2026 - As Melhores e Novidades, Caso Indefinido",00:05:14,15180,103,0,https://i.ytimg.com/vi/0g3WU6ZLOa0/maxresdefault.jpg,N/A
16,,,20,"Action_game, Video_game_culture, Role-playing_video_game, Action-adventure_game",12.99%,pt-PT,16,UCcOlGZMY19XQupKH4aigvkw,Overwatch Brasil,343000,AIPb5WxZHTw,2026-06-29T16:05:51Z,5.14 horas,Overwatch x YOASOBI | Trailer Oficial de Jogabilidade,"Encontre seu lugar entre as estrelas com Overwatch x YOASOBI.

Embarque em uma jornada estelar com Kiriko, Hanzo, Genji, Mizuki, Juno e Anran com novos cosméticos inspirados na música e na narrativa visual de YOASOBI.

Desbloqueie todos os visuais, emotes de dança, sprays e muito mais com o Pacotaço YOASOBI, ou compre os itens separadamente para montar seu estilo único.

Ouça agora a versão completa de “Orion”, de YOASOBI, e crie memórias inesquecíveis no campo de batalha quando Overwatch x YOASOBI chegar em 30 de junho.

Overwatch é gratuito para PC e consoles, incluindo Nintendo Switch™ 2",,00:01:26,5457,659,50,https://i.ytimg.com/vi/AIPb5WxZHTw/maxresdefault.jpg,BR
17,,,20,"Action-adventure_game, Video_game_culture, Action_game, Role-playing_video_game",15.04%,pt-PT,17,UCIwspRtKNszHhIhl36gREjQ,alanzoka,9170000,GPMLbBrbRUM,2026-06-29T15:00:03Z,6.24 horas,LEVEI 3 COM UMA ARMA DE ÁGUA! - FIRST CLASS TROUBLE COM OS AMIGOS,"OS MAIORES DESCONTOS ESTÃO NO KABUM!:
http://kb1.me/alanzokakabumyt

💜 LIVE: https://www.twitch.tv/alanzoka
📷 Instagram: https://www.instagram.com/alanzoka/
📧 alanzoka@vandep.ag
🐤 Twitter: https://twitter.com/alanzoka




#Alanzoka","alan, electronic, desire, edge, alanzoka, video do alanzoka, alanzoka da twitch, videos com alanzoka, alanzoka video, alanzoka memes, gameplay alanzoka, lives do alanzoka, lives, alanzoka jogando, first class trouble",01:10:54,107869,15787,441,https://i.ytimg.com/vi/GPMLbBrbRUM/maxresdefault.jpg,BR
18,,,10,"Religion, Music, Christian_music, Society",1.03%,pt-BR,18,UChzfdc3Nx_FQhXMXu2RprUQ,Nova Hinos Evangélicos,142000,TEe5wHsyvn4,2026-06-28T08:51:17Z,36.39 horas,"Louvores de Adoração 2026,Músicas Gospel Mais Tocadas que Tocam Profundamente o Coração dos Ouvintes","#LouvoresDeAdoração2026 #MúsicasGospel #HinosGospel
🎵 Louvores de Adoração 2026 | Músicas Gospel Mais Tocadas que Tocam Profundamente o Coração dos Ouvintes reúne canções inspiradoras que fortalecem a fé, renovam a esperança e aproximam você da presença de Deus. Cada louvor foi selecionado para proporcionar momentos de paz, reflexão e adoração sincera.

✨ Neste vídeo você encontrará:

Louvores de adoração emocionantes
Músicas gospel mais tocadas
Canções para oração e meditação
Louvores que fortalecem a fé
Melodias que trazem paz ao coração

🙏 Que estas músicas encham sua vida com a graça, o amor e a presença do Senhor. Ouça, adore e permita que a Palavra de Deus fale ao seu coração através de cada canção.

👍 Se este conteúdo abençoar você, deixe seu gostei, compartilhe com amigos e familiares e inscreva-se no canal para acompanhar novos vídeos de louvor e adoração.

🔔 Ative o sino de notificações para não perder nenhuma atualização.

Que Deus abençoe você e sua família hoje e sempre! ❤️","Louvores de Adoração 2026, Músicas Gospel Mais Tocadas que Tocam Profundamente o Coração dos Ouvintes, músicas gospel 2026, hinos gospel 2026, louvores mais tocados, gospel mais tocadas, melhores louvores 2026, louvor e adoração, músicas evangélicas, adoração a Deus, louvores para ouvir, louvores para orar, louvores para dormir, louvores que acalmam a alma, músicas cristãs, HINOS GOSPEL, 100 Louvores, Top 20 Músicas Gospel Mais Tocadas, musica gospel, os sonhos de deus, deus",02:09:01,89393,907,16,https://i.ytimg.com/vi/TEe5wHsyvn4/maxresdefault.jpg,BR
